{
  "schema_revision": 1,
  "template_id": "mr-baddeley-complex-dome-mk4",
  "template_name": "Mr Baddeley Complex Dome MK4",
  "template_revision": 1,
  "model": "MK4",
  "source": "AstroPixelsPlus data/panels.html",
  "coordinate_space": {
    "viewBox": "0 0 480 480"
  },
  "elements": [
    {
      "id": "HP2",
      "label": "HP2",
      "aliases": [
        "RHP"
      ],
      "in_layout": true,
      "element_type": "holo",
      "panel_kind": null,
      "mounted_on": null,
      "commandable": false,
      "capabilities": [
        "light",
        "aim",
        "effect"
      ],
      "render_order": 10,
      "geometry": {
        "type": "ellipse",
        "cx": 240.0,
        "cy": 81.0,
        "rx": 14.1,
        "ry": 10.9,
        "rotation": 0.0
      },
      "label_anchor": {
        "x": 240.0,
        "y": 81.0
      }
    },
    {
      "id": "P8",
      "label": "P8",
      "aliases": [],
      "in_layout": true,
      "element_type": "panel",
      "panel_kind": "fixed",
      "mounted_on": null,
      "commandable": false,
      "capabilities": [],
      "render_order": 20,
      "geometry": {
        "type": "svg_path",
        "d": "M 272.8,71.2 A 172,172 0 0 1 318.1,86.7 L 306.3,109.9 A 146,146 0 0 0 267.9,96.7 Z"
      },
      "label_anchor": {
        "x": 309.3,
        "y": 34.6
      },
      "callout": {
        "x": 309.3,
        "y": 38.6,
        "r": 14,
        "connector_to": {
          "x": 301.2,
          "y": 62.2
        }
      }
    },
    {
      "id": "RPSI",
      "label": "RPSI",
      "aliases": [
        "Rear PSI"
      ],
      "in_layout": true,
      "element_type": "psi",
      "panel_kind": null,
      "mounted_on": "P8",
      "commandable": false,
      "capabilities": [
        "light",
        "effect"
      ],
      "render_order": 21,
      "geometry": {
        "type": "point",
        "cx": 301.2,
        "cy": 62.2
      },
      "label_anchor": {
        "x": 309.3,
        "y": 43.6
      },
      "callout": {
        "x": 309.3,
        "y": 38.6,
        "r": 14,
        "connector_to": {
          "x": 301.2,
          "y": 62.2
        }
      }
    },
    {
      "id": "P7",
      "label": "P7",
      "aliases": [],
      "in_layout": true,
      "element_type": "panel",
      "panel_kind": "ring",
      "mounted_on": null,
      "commandable": true,
      "capabilities": [
        "open",
        "close",
        "flutter"
      ],
      "render_order": 30,
      "geometry": {
        "type": "svg_path",
        "d": "M 331.1,94.1 A 172,172 0 0 1 391.9,159.3 L 368.9,171.5 A 146,146 0 0 0 317.4,116.2 Z"
      },
      "label_anchor": {
        "x": 395.8,
        "y": 94.7
      },
      "callout": {
        "x": 395.8,
        "y": 94.7,
        "r": 12,
        "connector_to": {
          "x": 377.5,
          "y": 111.8
        }
      }
    },
    {
      "id": "P6",
      "label": "P6",
      "aliases": [],
      "in_layout": true,
      "element_type": "panel",
      "panel_kind": "fixed",
      "mounted_on": null,
      "commandable": false,
      "capabilities": [],
      "render_order": 40,
      "geometry": {
        "type": "svg_path",
        "d": "M 398.3,172.8 A 172,172 0 0 1 409.4,210.1 L 383.8,214.6 A 146,146 0 0 0 374.4,183.0 Z"
      },
      "label_anchor": {
        "x": 444.2,
        "y": 172.5
      },
      "callout": {
        "x": 444.2,
        "y": 179.5,
        "r": 16,
        "connector_to": {
          "x": 420.3,
          "y": 186.6
        }
      }
    },
    {
      "id": "MP",
      "label": "MP",
      "aliases": [
        "Magic Panel"
      ],
      "in_layout": true,
      "element_type": "panel",
      "panel_kind": "fixed",
      "mounted_on": null,
      "commandable": false,
      "capabilities": [],
      "render_order": 41,
      "geometry": {
        "type": "svg_path",
        "d": "M 398.3,172.8 A 172,172 0 0 1 409.4,210.1 L 383.8,214.6 A 146,146 0 0 0 374.4,183.0 Z"
      },
      "label_anchor": {
        "x": 444.2,
        "y": 179.5
      },
      "callout": {
        "x": 444.2,
        "y": 179.5,
        "r": 16,
        "connector_to": {
          "x": 420.3,
          "y": 186.6
        }
      }
    },
    {
      "id": "P5",
      "label": "P5",
      "aliases": [],
      "in_layout": true,
      "element_type": "panel",
      "panel_kind": "fixed",
      "mounted_on": null,
      "commandable": false,
      "capabilities": [],
      "render_order": 42,
      "geometry": {
        "type": "svg_path",
        "d": "M 398.3,172.8 A 172,172 0 0 1 409.4,210.1 L 383.8,214.6 A 146,146 0 0 0 374.4,183.0 Z"
      },
      "label_anchor": {
        "x": 444.2,
        "y": 186.5
      },
      "callout": {
        "x": 444.2,
        "y": 179.5,
        "r": 16,
        "connector_to": {
          "x": 420.3,
          "y": 186.6
        }
      }
    },
    {
      "id": "P4",
      "label": "P4",
      "aliases": [],
      "in_layout": true,
      "element_type": "panel",
      "panel_kind": "ring",
      "mounted_on": null,
      "commandable": true,
      "capabilities": [
        "open",
        "close",
        "flutter"
      ],
      "render_order": 50,
      "geometry": {
        "type": "svg_path",
        "d": "M 411.3,225.0 A 172,172 0 0 1 395.9,312.7 L 372.3,301.7 A 146,146 0 0 0 385.4,227.3 Z"
      },
      "label_anchor": {
        "x": 449.8,
        "y": 277.0
      },
      "callout": {
        "x": 449.8,
        "y": 277.0,
        "r": 12,
        "connector_to": {
          "x": 425.1,
          "y": 272.6
        }
      }
    },
    {
      "id": "P3",
      "label": "P3",
      "aliases": [],
      "in_layout": true,
      "element_type": "panel",
      "panel_kind": "ring",
      "mounted_on": null,
      "commandable": true,
      "capabilities": [
        "open",
        "close",
        "flutter"
      ],
      "render_order": 60,
      "geometry": {
        "type": "svg_path",
        "d": "M 389.0,326.0 A 172,172 0 0 1 365.8,357.3 L 346.8,339.6 A 146,146 0 0 0 366.4,313.0 Z"
      },
      "label_anchor": {
        "x": 411.2,
        "y": 366.7
      },
      "callout": {
        "x": 411.2,
        "y": 366.7,
        "r": 12,
        "connector_to": {
          "x": 391.1,
          "y": 351.8
        }
      }
    },
    {
      "id": "P2",
      "label": "P2",
      "aliases": [],
      "in_layout": true,
      "element_type": "panel",
      "panel_kind": "ring",
      "mounted_on": null,
      "commandable": true,
      "capabilities": [
        "open",
        "close",
        "flutter"
      ],
      "render_order": 70,
      "geometry": {
        "type": "svg_path",
        "d": "M 355.1,367.8 A 172,172 0 0 1 323.4,390.4 L 310.8,367.7 A 146,146 0 0 0 337.7,348.5 Z"
      },
      "label_anchor": {
        "x": 363.7,
        "y": 413.4
      },
      "callout": {
        "x": 363.7,
        "y": 413.4,
        "r": 12,
        "connector_to": {
          "x": 349.2,
          "y": 393.1
        }
      }
    },
    {
      "id": "P1",
      "label": "P1",
      "aliases": [],
      "in_layout": true,
      "element_type": "panel",
      "panel_kind": "ring",
      "mounted_on": null,
      "commandable": true,
      "capabilities": [
        "open",
        "close",
        "flutter"
      ],
      "render_order": 80,
      "geometry": {
        "type": "svg_path",
        "d": "M 310.0,397.1 A 172,172 0 0 1 272.8,408.8 L 267.9,383.3 A 146,146 0 0 0 299.4,373.4 Z"
      },
      "label_anchor": {
        "x": 304.1,
        "y": 443.1
      },
      "callout": {
        "x": 304.1,
        "y": 443.1,
        "r": 12,
        "connector_to": {
          "x": 296.5,
          "y": 419.3
        }
      }
    },
    {
      "id": "HP1",
      "label": "HP1",
      "aliases": [
        "FHP"
      ],
      "in_layout": true,
      "element_type": "holo",
      "panel_kind": null,
      "mounted_on": null,
      "commandable": false,
      "capabilities": [
        "light",
        "aim",
        "effect"
      ],
      "render_order": 90,
      "geometry": {
        "type": "ellipse",
        "cx": 237.2,
        "cy": 399.0,
        "rx": 16.5,
        "ry": 10.9,
        "rotation": 181.0
      },
      "label_anchor": {
        "x": 237.2,
        "y": 399.0
      }
    },
    {
      "id": "P14",
      "label": "P14",
      "aliases": [],
      "in_layout": true,
      "element_type": "panel",
      "panel_kind": "fixed",
      "mounted_on": null,
      "commandable": false,
      "capabilities": [],
      "render_order": 100,
      "geometry": {
        "type": "svg_path",
        "d": "M 198.4,406.9 A 172,172 0 0 1 154.0,389.0 L 167.0,366.4 A 146,146 0 0 0 204.7,381.7 Z"
      },
      "label_anchor": {
        "x": 160.2,
        "y": 433.5
      },
      "callout": {
        "x": 160.2,
        "y": 437.5,
        "r": 14,
        "connector_to": {
          "x": 169.6,
          "y": 414.3
        }
      }
    },
    {
      "id": "FPSI",
      "label": "FPSI",
      "aliases": [
        "Front PSI"
      ],
      "in_layout": true,
      "element_type": "psi",
      "panel_kind": null,
      "mounted_on": "P14",
      "commandable": false,
      "capabilities": [
        "light",
        "effect"
      ],
      "render_order": 101,
      "geometry": {
        "type": "point",
        "cx": 169.6,
        "cy": 414.3
      },
      "label_anchor": {
        "x": 160.2,
        "y": 442.5
      },
      "callout": {
        "x": 160.2,
        "y": 437.5,
        "r": 14,
        "connector_to": {
          "x": 169.6,
          "y": 414.3
        }
      }
    },
    {
      "id": "P13",
      "label": "P13",
      "aliases": [],
      "in_layout": true,
      "element_type": "panel",
      "panel_kind": "ring",
      "mounted_on": null,
      "commandable": true,
      "capabilities": [
        "open",
        "close",
        "flutter"
      ],
      "render_order": 110,
      "geometry": {
        "type": "svg_path",